{
  "pluginId": "zinc-sulfate-monohydrate",
  "type": "fertilizer",
  "version": "1.0.1",
  "defaultUnit": "lb",
  "pluginSchemaVersion": "1.1",
  "analysis": {
    "n": 0,
    "p": 0,
    "k": 0
  },
  "form": "soluble",
  "displayName": "Zinc Sulfate Monohydrate (35.5% Zn)",
  "organic": false,
  "applicationRange": {
    "min": 5,
    "max": 25,
    "unit": "lb-per-acre"
  },
  "complianceFlags": {
    "nonGmoCompliant": true,
    "certifiedOrganicAllowed": true,
    "transitioningAllowed": true,
    "notes": "Micronutrients—not to be used as a defoliant, herbicide, or desiccant. Those made from nitrates or chlorides are not allowed. Micronutrient deficiency must be documented by soil or tissue testing or other documented and verifiable method as approved by the certifying agent."
  },
  "notes": "Granular zinc fertilizer. Standard corrective for Zn deficiency in corn, edible bean, pecan on alkaline or sandy soils."
}