{
  "pluginId": "map-11-52-0",
  "type": "fertilizer",
  "displayName": "MAP — Monoammonium Phosphate (11-52-0)",
  "version": "1.0.0",
  "defaultUnit": "lb",
  "analysis": {
    "n": 11,
    "p": 52,
    "k": 0
  },
  "form": "granular",
  "organic": false,
  "applicationRange": {
    "min": 50,
    "max": 200,
    "unit": "lb-per-acre"
  },
  "notes": "Phosphate starter — soil-band at planting. Less ammonia volatility than DAP. Soil-test based rate.",
  "complianceFlags": {
    "omriListed": false,
    "nonGmoCompliant": true,
    "certifiedOrganicAllowed": false,
    "transitioningAllowed": false
  },
  "pluginSchemaVersion": "1.1"
}
