{
  "pluginId": "alfalfa-pellets-3-1-2",
  "type": "fertilizer",
  "displayName": "Alfalfa Pellets (3-1-2)",
  "version": "1.0.1",
  "defaultUnit": "lb",
  "analysis": {
    "n": 3,
    "p": 1,
    "k": 2
  },
  "form": "compost",
  "organic": true,
  "applicationRange": {
    "min": 200,
    "max": 800,
    "unit": "lb-per-acre"
  },
  "notes": "Slow-release organic N + biological tonic. Triacontanol growth-promoter content. Excellent garlic + perennial side-dress.",
  "complianceFlags": {
    "nonGmoCompliant": true
  },
  "pluginSchemaVersion": "1.1"
}
