{
  "pluginId": "sulfur-pastille-elemental",
  "type": "fertilizer",
  "version": "1.0.1",
  "defaultUnit": "lb",
  "pluginSchemaVersion": "1.1",
  "analysis": {
    "n": 0,
    "p": 0,
    "k": 0
  },
  "form": "granular",
  "displayName": "Elemental Sulfur Pastilles (90% S)",
  "organic": true,
  "secondaryNutrients": {
    "s": 90
  },
  "applicationRange": {
    "min": 100,
    "max": 800,
    "unit": "lb-per-acre"
  },
  "complianceFlags": {
    "nonGmoCompliant": true
  },
  "notes": "Slow-release elemental sulfur. Used to acidify alkaline soils (lowering pH 0.5 to 1.5 units per ton/acre over 1 to 2 seasons)."
}