{
  "pluginId": "pgpr-azotobacter-inoculant",
  "type": "fertilizer",
  "version": "1.0.1",
  "defaultUnit": "gal",
  "pluginSchemaVersion": "1.1",
  "analysis": {
    "n": 0,
    "p": 0,
    "k": 0
  },
  "form": "liquid",
  "displayName": "PGPR Azotobacter Inoculant (free-living N-fixer)",
  "organic": true,
  "applicationRange": {
    "min": 1,
    "max": 4,
    "unit": "qt-per-acre"
  },
  "complianceFlags": {
    "nonGmoCompliant": true
  },
  "notes": "Free-living PGPR blend (Azotobacter, Azospirillum). Provides modest N fixation outside legume hosts."
}