{
  "pluginId": "fish-hydrolysate-2-4-0-2",
  "type": "fertilizer",
  "version": "1.0.1",
  "defaultUnit": "gal",
  "pluginSchemaVersion": "1.1",
  "analysis": {
    "n": 2,
    "p": 4,
    "k": 0
  },
  "form": "liquid",
  "displayName": "Fish Hydrolysate Liquid (2-4-0.2)",
  "organic": true,
  "applicationRange": {
    "min": 1,
    "max": 4,
    "unit": "gal-per-acre"
  },
  "complianceFlags": {
    "nonGmoCompliant": true,
    "certifiedOrganicAllowed": true,
    "transitioningAllowed": true,
    "notes": "Liquid fish products—can be pH adjusted with sulfuric, citric or phosphoric acid. The amount of acid used shall not exceed the minimum needed to lower the pH to 3.5."
  },
  "notes": "Cold-process enzymatically-digested fish. Retains amino acids and oils stripped from fish emulsion. Strong biostimulant."
}