{
  "pluginId": "calcium-chloride-foliar",
  "type": "fertilizer",
  "version": "1.0.1",
  "defaultUnit": "lb",
  "pluginSchemaVersion": "1.1",
  "analysis": {
    "n": 0,
    "p": 0,
    "k": 0
  },
  "form": "soluble",
  "displayName": "Calcium Chloride (foliar 28% Ca)",
  "organic": false,
  "secondaryNutrients": {
    "ca": 28
  },
  "applicationRange": {
    "min": 2,
    "max": 8,
    "unit": "lb-per-acre"
  },
  "complianceFlags": {
    "nonGmoCompliant": true,
    "certifiedOrganicAllowed": true,
    "transitioningAllowed": true,
    "notes": "Calcium chloride, brine process is natural and prohibited for use except as a foliar spray to treat a physiological disorder associated with calcium uptake."
  },
  "notes": "High-purity calcium chloride for foliar Ca correction. Standard for blossom-end rot when soil Ca adequate but uptake limited."
}