{
  "pluginId": "sop-0-0-50",
  "type": "fertilizer",
  "displayName": "Sulfate of Potash / SOP (0-0-50, +18S)",
  "version": "1.0.1",
  "defaultUnit": "lb",
  "analysis": {
    "n": 0,
    "p": 0,
    "k": 50
  },
  "form": "granular",
  "organic": false,
  "secondaryNutrients": {
    "s": 18
  },
  "applicationRange": {
    "min": 50,
    "max": 250,
    "unit": "lb-per-acre"
  },
  "notes": "K + S without chloride. For chloride-sensitive crops (potato, tobacco, vegetables, tree fruit). More expensive than MOP.",
  "complianceFlags": {
    "nonGmoCompliant": true
  },
  "pluginSchemaVersion": "1.1"
}
