{
  "pluginId": "kelp-meal-1-0-2",
  "type": "fertilizer",
  "displayName": "Kelp Meal (1-0-2)",
  "version": "1.0.1",
  "defaultUnit": "lb",
  "analysis": {
    "n": 1,
    "p": 0,
    "k": 2
  },
  "form": "meal",
  "organic": true,
  "applicationRange": {
    "min": 100,
    "max": 400,
    "unit": "lb-per-acre"
  },
  "notes": "Mineral + plant-hormone amendment. Macro-nutrient value low; valued for trace elements + alginic acid soil structure benefit.",
  "complianceFlags": {
    "nonGmoCompliant": true
  },
  "pluginSchemaVersion": "1.1"
}
